{
  "id": "slides-ldv-beamer",
  "name": "LDV Beamer",
  "slug": "ldv-beamer",
  "kind": "real-template",
  "maturity": "production",
  "category": "slides",
  "subcategory": "beamer",
  "family": "presentation",
  "description": "Existing Beamer presentation template package preserved as-is and integrated into the template platform architecture.",
  "tags": [
    "slides",
    "beamer",
    "presentation",
    "academic"
  ],
  "author": "Repository owner",
  "version": "1.0.0",
  "engine": "lualatex",
  "main_file": "example.tex",
  "preview_image": null,
  "preview_document": "example.pdf",
  "preview_ready": false,
  "compilation_status": "not-checked",
  "listing_visibility": "public",
  "status": "available",
  "featured": true,
  "sort_order": 100,
  "created_at": "2026-04-16",
  "updated_at": "2026-04-16",
  "dependencies": [
    "latexmk",
    "beamer",
    "fontspec",
    "luatexja"
  ],
  "license": "unspecified",
  "language": "vi",
  "intended_use": "slide deck",
  "notes": [
    "Template package contents are preserved rather than restyled.",
    "Legacy helper file readme.txt remains part of the package.",
    "The platform layer treats this as a real preserved template package rather than a scaffold."
  ]
}
