{
  "id": "reports-fit-hcmus",
  "name": "FIT@HCMUS Report",
  "slug": "fit-hcmus-report",
  "kind": "real-template",
  "maturity": "production",
  "category": "reports",
  "subcategory": "report-family",
  "family": "report-family",
  "description": "Long-form academic report package tailored for FIT @ VNUHCM University of Science students, with a custom TikZ front page, report-style preamble, and bibliography wiring.",
  "tags": [
    "reports",
    "academic",
    "hcmus",
    "vnuhcm",
    "pdflatex",
    "bibtex"
  ],
  "author": "tranlynhathao",
  "version": "1.0.0",
  "engine": "pdflatex",
  "main_file": "main.tex",
  "preview_image": "templates/reports/fit@vnuhcmus-custom-template/asset/frontpage.png",
  "preview_document": "pdf_demo/Report.pdf",
  "preview_ready": true,
  "compilation_status": "verified",
  "listing_visibility": "public",
  "status": "available",
  "featured": true,
  "sort_order": 150,
  "created_at": "2026-04-18",
  "updated_at": "2026-04-18",
  "dependencies": [
    "latexmk",
    "pdflatex",
    "bibtex",
    "graphicx",
    "tikz",
    "hyperref",
    "fancyhdr",
    "titlesec",
    "tocbibind",
    "natbib",
    "vntex",
    "fontawesome"
  ],
  "license": "unspecified",
  "language": "en",
  "intended_use": "academic report",
  "notes": [
    "First real template in the reports category; the report-family scaffold remains the structural reference.",
    "The front-page image in asset/frontpage.png is used as the catalog thumbnail and was produced by the template author.",
    "pdf_demo/Report.pdf is an author-provided compiled snapshot; the platform separately verifies main.tex compiles via pdflatex.",
    "Most report body sections are commented out in main.tex by default so the package compiles as a blank shell ready to be filled in."
  ]
}
